lead_id,source_channel,lead_name,canonical_url,compensation,status_signal,work_mode,ts_python_fit,competition_signal,go_no_go,notes
DPL-001,GitHub/Algora,Coolify Debian 13 bounty,https://github.com/coollabsio/coolify/issues/8154,"$6,900 bounty",open_issue_bounty,remote_async,medium,existing_pending_claim,GO_CONDITIONAL,"High EV; proceed only if maintainer confirms concurrent attempts accepted"
DPL-002,GitHub/Algora,Archestra MCP Apps support,https://github.com/archestra-ai/archestra/issues/1301,"$900 bounty",open_bounty,remote_async,medium,unknown_claim_density,GO,"Lower EV but likely fast cycle; useful fallback"
DPL-003,GitHub/Algora,Twenty IMAP bounty,https://algora.io/bounties,"$2,500 bounty",uncertain_stale,remote_async,low,age_7_months_signal,NO_GO,"Status uncertainty; requires revalidation before effort"
DPL-004,HackerNews,Wave Applied AI Engineer,https://news.ycombinator.com/item?id=46967582,"Salary up to $222,700 + equity",active_hiring,remote_with_geo_constraints,high,standard_job_market,GO,"Strong comp and Python fit; already included in WIH feeder"
DPL-005,HackerNews,Areto Lead Product Engineer,https://news.ycombinator.com/,"Competitive + equity",active_unverified,remote_unknown,medium,low_visibility,GO_CONDITIONAL,"Need canonical job URL + explicit comp range before outreach"
DPL-006,Reddit,AI chatbot contract listing,https://www.reddit.com/,"$20/hr x ~150h (~$3k)",older_listing,remote_contract,medium,high_listing_decay,NO_GO,"Older listing; low confidence still open"
