lead_id,hn_canonical_url,company_or_job_url,company,role_title,posting_date_utc,role_type,remote_signal,active_status,ts_python_signal,compensation_original_snippet,comp_usd_annual_min,comp_usd_annual_max,annualization_method,fit_score_10,risk_flags,contact_or_apply_path,notes
HN-WIH-2026-001,https://news.ycombinator.com/item?id=46857491,https://jobs.ongoody.com/#hn,Goody,"Staff/Senior Software Engineer (multi-role)",2026-02-02,full-time,"Remote; North/South America (one role US/Canada only)","verified_active_hn_post + careers_page_live_2026-02-14","TypeScript explicit; Python accepted backend","Remote | $150–250K + equity and benefits; Staff Software Engineer ($200–250K); Senior Software Engineer ($150–200K)",150000,250000,"Used HN full-time annual range; excluded Data Analyst role",9.2,"region_constraint_by_role;multi_role_post","https://jobs.ongoody.com/#hn; mailto:mark@ongoody.com","canonical_reconciliation_cycle_2026-02-14"
HN-WIH-2026-002,https://news.ycombinator.com/item?id=46857939,https://www.greenline.ai/careers,Greenline,"Founding Engineer: Backend + Data",2026-02-02,full-time,"Remote (U.S. only)","verified_active_hn_post + direct_contact_present","TypeScript explicit (yarn workspace monorepo)","Remote (U.S. only) | $175k–$225k base + equity (1.0–2.5%)",175000,225000,"Annual base range quoted directly in HN post",8.8,"us_only_remote;founding_stage_execution_risk","https://www.greenline.ai/careers; mailto:hello@greenline.ai","canonical_reconciliation_cycle_2026-02-14"
HN-WIH-2026-003,https://news.ycombinator.com/item?id=46866498,https://careers.reef.pl/?utm_source=hackernews,Reef Technologies,Senior Python Backend Engineer,2026-02-03,contract_b2b,Fully remote,"verified_active_hn_post + apply_link_present","Python explicit (5+ years programming; 1+ year Python)","Salary on a B2B contract: 45-70 USD or 180-280 PLN per hour",93600,145600,"Converted USD hourly range using 40h/week * 52 weeks",8.4,"b2b_contract_only;hourly_variability;minimum_30h_week","https://careers.reef.pl/?utm_source=hackernews; mailto:hiring@reef.pl","canonical_reconciliation_cycle_2026-02-14"
HN-WIH-2026-004,https://news.ycombinator.com/item?id=46857982,https://jobs.gem.com/piqenergy/,Piq Energy,Full Stack Software Engineer,2026-02-02,full-time,"US Remote or SF/Athens","verified_active_hn_post + careers_page_accessed_2026-02-14","TypeScript + Python + AI agents explicit","SF, Athens, or US REMOTE | Full-time | $150k-$250k + equity (SF; location-adjusted)",150000,250000,"Used quoted SF annual base range; remote comp may be location-adjusted",9.1,"geo_adjusted_comp","https://jobs.gem.com/piqenergy/","canonical_reconciliation_cycle_2026-02-14"
HN-WIH-2026-005,https://news.ycombinator.com/item?id=46967582,https://www.wave.com/en/careers/job/5779974004/,Wave,Applied AI Engineer,2026-02-11,full-time,"Remote (US/UK/Canada/Spain + selected hubs)","verified_active_hn_post + job_page_live_2026-02-14","Python backend explicit; TypeScript frontend in stack","Salary up to $222,700 + equity.",0,222700,"HN provides only upper bound; min sentinel set to 0 for schema consistency",9.3,"upper_bound_only_no_floor_sentinel0;country_hub_constraints","https://www.wave.com/en/careers/job/5779974004/","canonical_reconciliation_cycle_2026-02-14"
HN-WIH-2026-006,https://news.ycombinator.com/item?id=46889635,https://www.prompthealth.com/careers#list,Prompt Health,Senior AI Engineer (Natural Language Systems),2026-02-04,full-time,"REMOTE (US)","verified_active_hn_post + apply_link_present","Python + NLP + LLMs explicit","Senior AI Engineer (Natural Language Systems): $160k–$220k",160000,220000,"Annual base range quoted directly in HN post",9.4,"us_only_remote;multi_role_post","https://www.prompthealth.com/careers#list","added_from_feeder_round9_reconciliation"
HN-WIH-2026-007,https://news.ycombinator.com/item?id=46862438,https://www.level12.io/careers/,Level 12,"Full Stack Web Developer (Mid/Senior)",2026-02-02,full-time,REMOTE,"verified_active_hn_post + direct_contact_present","Python + JavaScript explicit","SALARY:$95K-145K+",95000,145000,"Used quoted annual range; '+' retained as upside note",8.5,"hiring_intent_tentative_note","https://www.level12.io/careers/; mailto:randy.syring@level12.io","added_from_feeder_round9_reconciliation"
HN-WIH-2026-008,https://news.ycombinator.com/item?id=46857529,https://www.prairielearn.com/jobs-ashby?ashby_jid=ee6fdbc3-1...,PrairieLearn,Full-Stack Software Engineer,2026-02-02,full-time,"Remote (US only)","verified_active_hn_post + apply_link_present","TypeScript backend + React + AI tooling","Salary: $100k-$140k depending on experience; stock options (0.5% - 1.5%)",100000,140000,"Annual base range quoted directly in HN post",8.9,"us_only_remote;no_visa_sponsorship","https://www.prairielearn.com/jobs-ashby?ashby_jid=ee6fdbc3-1...","added_from_feeder_round9_reconciliation"